id,name,url,employment_id,employment_name,salary_from,salary_to,snippet_requirement,snippet_responsibility,experience_id,experience_name,employer_id,employer_name,address_lat,address_lng,professional_roles_id,professional_roles_name
82052059,Помощник повара,https://hh.ru/applicant/vacancy_response?vacancyId=82052059,full,Полная занятость,70000,70000,"Стаж работы в должности повара 3 разряда не менее 2-х лет, умение работать с тех. картами, соблюдение СанПиНа.","Приготовление не сложных блюд, чистка овощей, работа с заготовками, работа на линии раздачи (знание порционирования блюд), помощь поварам 4 и...",between1And3,От 1 года до 3 лет,1071927,Литона,,,,
81074553,Торговый представитель,https://hh.ru/applicant/vacancy_response?vacancyId=81074553,full,Полная занятость,80000,140000,"Активность, целеустремленность, коммуникабельность, нацеленность на результат, ответственность. Желание развиваться в продажах и зарабатывать. Готовность к работе разъездного характера.",Работа с существующей клиентской базой. Ведение переговоров с ключевыми клиентами. Сбор заявок. Контроль дебиторской задолженности. Мониторинг и анализ рынка.,between1And3,От 1 года до 3 лет,5651835,Восхождение,,,,
82033360,Разнорабочий,https://hh.ru/applicant/vacancy_response?vacancyId=82033360,full,Полная занятость,65000,65000,"Стрессоустойчивость, без хронических заболеваний спины! Работа с ненормированным графиком. Трудолюбие!","Погрузка и выгрузка товара, экспедиция ТМЦ, опыт работы на пищеблоке.",noExperience,Нет опыта,1071927,Литона,,,,
82026131,Ассистент руководителя,https://hh.ru/applicant/vacancy_response?vacancyId=82026131,part,Частичная занятость,20000,,"Быть моей «правой рукой», быстро и эффективно выполнять поставленные задачи. * Главная ценность – мои знания, навыки и опыт, которые ты получишь...","Сбор, структурирование, анализ информации. * Работа с google документами, excel таблицами.",noExperience,Нет опыта,9049720,Григорьев Анатолий Юрьевич,42.831046,132.897563,,
79809010,"Водитель-экспедитор с личным грузовым автомобилем 1,5- 3 тонны (тент, будка)",https://hh.ru/applicant/vacancy_response?vacancyId=79809010,full,Полная занятость,110000,140000,"Водительское удостоверение категории В,С. Умение ориентироваться в городе. Наличие грузового автомобиля с крытым кузовом (тент/будка), грузоподъёмность от 1...","Получение и погрузка товара на складе. Развоз товара по торговым точкам. Разгрузка товара, передача клиенту. Контроль подписания сопроводительных документов.",noExperience,Нет опыта,2548809,Binggrae (ИП Леонова Наталья Викторовна),42.840282,132.928132,,
81005987,Инженер/Мастер по ремонту цифровой техники,https://hh.ru/applicant/vacancy_response?vacancyId=81005987,full,Полная занятость,60000,,"Активным, целеустремленным, ответственным человеком. Имеющим опыт в области ремонта и обслуживания цифровой техники. Приветствуются навыки компонентного ремонта.","Диагностика, ремонт и обслуживание цифровой, оргтехники. Заполнение сопроводительных документов, внесение данных в базу 1С. Контроль сроков проведения сервисных работ. ",between1And3,От 1 года до 3 лет,1025275,Сеть магазинов цифровой и бытовой техники DNS,42.832897,132.896943,,
81006562,Сервисный мастер мелкой бытовой техники,https://hh.ru/applicant/vacancy_response?vacancyId=81006562,full,Полная занятость,60000,,"Активным, целеустремленным, ответственным человеком. Имеющим опыт в области ремонта и обслуживания бытовой техники. Приветствуются навыки компонентного ремонта.","Цифровая техника. Мелко-бытовая техника. Диагностика, ремонт и обслуживание малой бытовой техники. Заполнение сопроводительных документов, внесение данных в базу 1...",between1And3,От 1 года до 3 лет,1025275,Сеть магазинов цифровой и бытовой техники DNS,42.832897,132.896943,,
79967030,"Продавец-кассир (пр-кт Северный, 4)",https://hh.ru/applicant/vacancy_response?vacancyId=79967030,full,Полная занятость,40000,,"Клиентоориентированность. Желание работать с людьми, стрессоустойчивость. Энергичность и позитивный настрой.","Работа с покупателями (консультирование, прямые продажи). Поддержание стандартов работы магазина. Контроль наличия товара. Поддержание порядка в торговом зале. ",between1And3,От 1 года до 3 лет,4803817,Алеут фирменная розничная сеть Ратимир,42.838801,132.879875,,
80015247,"Продавец-кассир (ул. Постышева, 2/21)",https://hh.ru/applicant/vacancy_response?vacancyId=80015247,full,Полная занятость,40000,,"Клиентоориентированность. Желание работать с людьми, стрессоустойчивость. Энергичность и позитивный настрой.","Работа с покупателями (консультирование, прямые продажи). Поддержание стандартов работы магазина. Контроль наличия товара. Поддержание порядка в торговом зале. ",between1And3,От 1 года до 3 лет,4803817,Алеут фирменная розничная сеть Ратимир,42.834543,132.900563,,
80026597,"Продавец-кассир (Находка, ТЦ Тихоокеанский)",https://hh.ru/applicant/vacancy_response?vacancyId=80026597,full,Полная занятость,40000,,"Клиентоориентированность. Желание работать с людьми, стрессоустойчивость. Энергичность и позитивный настрой.","Работа с покупателями (консультирование, прямые продажи). Поддержание стандартов работы магазина. Контроль наличия товара. Поддержание порядка в торговом зале. ",between1And3,От 1 года до 3 лет,4803817,Алеут фирменная розничная сеть Ратимир,42.811868,132.876515,,
80136020,Продавец-кассир (район КПД),https://hh.ru/applicant/vacancy_response?vacancyId=80136020,full,Полная занятость,40000,,"Клиентоориентированность. Желание работать с людьми, стрессоустойчивость. Энергичность и позитивный настрой.","Работа с покупателями (консультирование, прямые продажи). Поддержание стандартов работы магазина. Контроль наличия товара. Поддержание порядка в торговом зале. ",between1And3,От 1 года до 3 лет,4803817,Алеут фирменная розничная сеть Ратимир,42.854202,132.958334,,
81624978,Бариста-повар,https://hh.ru/applicant/vacancy_response?vacancyId=81624978,full,Полная занятость,30000,,,Работать с кассой. Поддерживать чистоту оборудования и самой кофейни.,noExperience,Нет опыта,1898410,Сити Кофе Владивосток,,,,
82013585,Специалист по транспортной безопасности (охранник),https://hh.ru/applicant/vacancy_response?vacancyId=82013585,full,Полная занятость,40000,,Средне профессиональное образование. Рассматриваем кандидатов без опыта работы.,"Проведение осмотра лиц и транспорта на территории АО ""НСРЗ"".",between1And3,От 1 года до 3 лет,1949202,Находкинский судоремонтный завод,42.800743,132.876075,,
82013560,Электромонтажник судовой,https://hh.ru/applicant/vacancy_response?vacancyId=82013560,full,Полная занятость,50000,,Опыт работы с электрооборудованием на судах и на электромонтажных работах.,"Работы по монтажу электрооборудования, кабельных трасс. Ремонт электрооборудования.",between1And3,От 1 года до 3 лет,1949202,Находкинский судоремонтный завод,42.800743,132.876075,,
82013524,Рабочий по комплексному обслуживанию и ремонту зданий,https://hh.ru/applicant/vacancy_response?vacancyId=82013524,full,Полная занятость,30000,35000,,"Ремонт и обслуживание административного здания, общежития. Мелкий и средний ремонт по заявкам. Погрузка, выгрузка и перемещение мебели, материалов и т...",between1And3,От 1 года до 3 лет,1949202,Находкинский судоремонтный завод,42.800743,132.876075,,
82013479,Мастер (судоремонт),https://hh.ru/applicant/vacancy_response?vacancyId=82013479,full,Полная занятость,35000,,Наличие технического образования (желательно механик судовой). Знание основных систем и теории устройства судна. Опыт управления коллективом от 10 человек. ,"Обеспечение правильной расстановки рабочих для выполнения плановых заданий. Обеспечение выполнения участком плановых заданий по объему производства, принятие выполненных работ у...",between1And3,От 1 года до 3 лет,1949202,Находкинский судоремонтный завод,42.800743,132.876075,,
82013437,Машинист крана (крановщик),https://hh.ru/applicant/vacancy_response?vacancyId=82013437,full,Полная занятость,45000,60000,Документы подтверждающие квалификацию (удостоверение машиниста крана). Опыт работы по специальности обязателен.,Погрузо-разгрузочные работы (на портальном кране).,between3And6,От 3 до 6 лет,1949202,Находкинский судоремонтный завод,42.800743,132.876075,,
82013344,Старший электромеханик на ДОК,https://hh.ru/applicant/vacancy_response?vacancyId=82013344,full,Полная занятость,53000,,Документы подтверждающие квалификацию. Опыт работы по специальности обязателен.,Профессиональный ремонт и обслуживание электрооборудования плавдока и т.д. - Работа на территории организации (г Находка).,between1And3,От 1 года до 3 лет,1949202,Находкинский судоремонтный завод,42.800743,132.876075,,
82013315,Инженер-технолог,https://hh.ru/applicant/vacancy_response?vacancyId=82013315,full,Полная занятость,60000,,"Документы подтверждающие квалификацию. Опыт работы по специальности приветствуется. Умение работать мерительными инструментами. Работа в IC, AutoCAR приветствуется.","Оформление дефектовочных актов. Определение методов ремонта. Согласование методов ремонта с Заказчиком РМРС, ВП. Сопровождение ремонта - оформление эскизов, согласование замены материалов...",between1And3,От 1 года до 3 лет,1949202,Находкинский судоремонтный завод,42.800743,132.876075,,
82013272,Слесарь-сантехник,https://hh.ru/applicant/vacancy_response?vacancyId=82013272,full,Полная занятость,33000,,Документы подтверждающие квалификацию. Опыт работы по специальности.,"Обеспечение исправного состояния, безаварийную и надежную работу обслуживаемых систем отопления, водоснабжения, канализации и водостоков, своевременный качественный ремонт.",between1And3,От 1 года до 3 лет,1949202,Находкинский судоремонтный завод,42.800743,132.876075,,
81205344,Повар,https://hh.ru/applicant/vacancy_response?vacancyId=81205344,full,Полная занятость,48000,52800,"Ты имеешь опыт работы поваром паназиатской кухни, поваром холодного/горячего цеха, поваром-универсалом? *У тебя нет опыта работы и есть...",Готовить блюда японской кухни. Поддерживать рабочее место в чистоте и порядке. Поддерживать санитарные нормы и правила.,noExperience,Нет опыта,2021807,Суши Мастер,,,,
82012069,Слесарь-ремонтник,https://hh.ru/applicant/vacancy_response?vacancyId=82012069,full,Полная занятость,,,"Средне техническое образование. Знание устройства ремонтируемых инженерных систем и оборудования. Знание устройства, назначение и правила применения используемых контрольно-измерительных инструментов. ","Производить регламентные работы, ППР, ТО, ремонт, монтаж, демонтаж, испытание, регулирование, наладку инженерных систем и инженерного оборудования и сдача после ремонта. ",noExperience,Нет опыта,697283,Группа Компаний «Доброфлот»,42.866085,132.681805,,
80559269,Курьер,https://hh.ru/applicant/vacancy_response?vacancyId=80559269,full,Полная занятость,28500,,,"Вести своевременную обработку поступающей и отправляемой корреспонденции. Осуществлять подготовку к отправке почтовой корреспонденции (регистрация, конвертирование, создание реестров). Осуществлять доставку корреспонденции...",noExperience,Нет опыта,101861,ФГУП Росморпорт,,,,
80558436,Менеджер по продажам,https://hh.ru/applicant/vacancy_response?vacancyId=80558436,full,Полная занятость,70000,,Знание этапов продаж и умение применять их на практике. Грамотная речь. Желание помогать клиентам в выборе товара. Уверенные навыки работы...,"Консультации клиентов в торговом зале. Оформление в 1С и сопровождение продаж. Ведение текущих продаж (прием заявок по телефону, контроль...",between1And3,От 1 года до 3 лет,637674,Эксполес,42.851208,132.934142,,
78597814,Супервайзер торговых представителей,https://hh.ru/applicant/vacancy_response?vacancyId=78597814,full,Полная занятость,70000,70000,"Опыт работы Супервайзером от 1 года или Торговым представителем от 3 х лет. Уверенный пользователь ПК (знание Microsoft Office, 1...","Анализ и контроль дебиторской задолженности. Выставление задач команде торговых представителей и контроль их выполнения. Ведение отчётности и документооборота, согласно требованиям...",between1And3,От 1 года до 3 лет,5600634,"Владторг, филиал в г.Находка",42.842364,132.931088,,
77531122,Координатор отдела продаж,https://hh.ru/applicant/vacancy_response?vacancyId=77531122,full,Полная занятость,35000,40000,"Уверенный пользователь ПК (знание Microsoft Office, 1С и специальных учетных программ Safari, Сhicago, SalesWorks). Аналитические способности. Навыки телефонного общения...","Формирование отчетности о текущем выполнении плановых заданий, дистрибуции, отгрузках, дебиторской задолженности. Заведение заказов в учетной программе, выставление счетов, подготовка договоров...",noExperience,Нет опыта,5600634,"Владторг, филиал в г.Находка",42.842364,132.931088,,
82007757,Электрогазосварщик,https://hh.ru/applicant/vacancy_response?vacancyId=82007757,full,Полная занятость,94800,94800,"знание электротехники, технологии плавления металлов. -знание свойств газов, применяемых для антиокисления. -знание методов и принципов действия используемых агрегатов и оборудования. -",изготовление и выпуск качественной продукции. -работа согласно плану технологической подготовки производства сварочных работ. -планирование сроков и объемов работы. -,between1And3,От 1 года до 3 лет,2518299,Global Ports Management,,,,
81068245,Установщик автостекол (ученик),https://hh.ru/applicant/vacancy_response?vacancyId=81068245,probation,Стажировка,50000,,Ответственность и аккуратность в работе.,Демонтаж/монтаж автостёкол. Поддержание порядка на рабочем месте.,noExperience,Нет опыта,114735,Автотрейд,42.847626,132.946835,,
80553780,Электромеханик судовой,https://hh.ru/applicant/vacancy_response?vacancyId=80553780,full,Полная занятость,60000,,Среднее профессиональное образование - программы подготовки специалистов среднего звена или высшее образование - специалитет. Наличие диплома судового электромеханика. Наличие свидетельств о прохождении...,"Техническое обслуживание электрооборудования, электротехнических средств автоматики, навигации и связи судна. Ремонт электрооборудования, электротехнических средств автоматики, навигации и связи судна. ",noExperience,Нет опыта,101861,ФГУП Росморпорт,,,,
82005651,Инженер ПТО,https://hh.ru/applicant/vacancy_response?vacancyId=82005651,full,Полная занятость,50000,,Навык работы в AutoCad. Высшее техническое образование. Уверенный пользователь компьютера.,"Сбор исходно-разрешительной документации для проектирования, получение ТУ на подключение и пересечение объекта под руководством ведущего инженера. Подготовка и отправка...",noExperience,Нет опыта,2987601,АртГЕО-ДВ,,,,
80401776,Торговый представитель,https://hh.ru/applicant/vacancy_response?vacancyId=80401776,full,Полная занятость,72000,,Не любишь сидеть на одном месте. Быстро усваиваешь новую информацию и сразу готов применять знания на практике. Можешь найти подход...,"Выполнять план по объёму продаж на закрепленной территории с активной базой клиентов. Выполнять процедуры визита, согласно стандартам компании. ",noExperience,Нет опыта,99061,Эй-Пи Трейд,42.7784,132.861855,,
82004922,Мастер по ремонту компьютеров,https://hh.ru/applicant/vacancy_response?vacancyId=82004922,full,Полная занятость,50000,,"Знание популярных компьютерных программ. Навыки переустановки Windows, настройки роутера. Желательно уметь разбирать компьютер и ноутбук и чистить внутри от пыли. ",Выезжать на дом к физическим лицам для ремонта и настройки компьютера или ноутбука. Диагностировать неисправности на месте у клиентов компании. ,noExperience,Нет опыта,9044703,Гусев Иван Сергеевич,,,,
82004607,Менеджер по клинингу,https://hh.ru/applicant/vacancy_response?vacancyId=82004607,full,Полная занятость,30000,,,Обязанности: Контроль выполнения поставленных задач сотрудниками объекта.,noExperience,Нет опыта,9861366,Сфера ДВ,,,,
80683056,Начинающий специалист по обслуживанию POS-терминалов,https://hh.ru/applicant/vacancy_response?vacancyId=80683056,full,Полная занятость,48000,,"Владение ПК на уровне уверенного пользователя (переустановка, обновление ПО, ОС). Интересуетесь изучением и развитием в сфере информационных технологий.","Техническое обслуживание банковского оборудования - платежных терминалов, используемых для оплаты банковской картой (POS) и онлайн-касс: установка, демонтаж, сервисное обслуживание. ",noExperience,Нет опыта,1237073,АТМ АЛЬЯНС,42.808475,132.872104,,
