id,name,url,employment_id,employment_name,salary_from,salary_to,snippet_requirement,snippet_responsibility,experience_id,experience_name,employer_id,employer_name,address_lat,address_lng,professional_roles_id,professional_roles_name
81435505,ZJ - Машинист экскаватора（挖机司机1号项目）,https://hh.ru/applicant/vacancy_response?vacancyId=81435505,full,Полная занятость,75000,75000,"Наличие действующего удостоверения тракториста-машиниста. (D,E). Опыт работы машинистом экскаватора от 5 лет. Ответственность, исполнительность.",Выполнение работ экскаватором по разработке грунта и погрузке его в транспортные средства. Выполнение работ экскаватором по рытью траншей. ,between3And6,От 3 до 6 лет,3698980,Китайская компания коммуникаций и строительства,,,,
78145180,Оператор по продаже инвестиций (удалённо),https://hh.ru/applicant/vacancy_response?vacancyId=78145180,full,Полная занятость,50000,,"Готовность выполнять функционал от 30 часов в неделю. Желание разобраться в продукте — мы поможем на старте, заучивать ничего не придется. ",Отвечать на возникшие вопросы клиента по продукту на исходящих и входящих звонках. База для обзвона предоставляется. Продавать инвестиционные продукты банка...,noExperience,Нет опыта,78638,Тинькофф,,,,
78361760,Менеджер по продажам B2B (удалённо),https://hh.ru/applicant/vacancy_response?vacancyId=78361760,full,Полная занятость,80000,150000,Имеете опыт работы от 6 месяцев в активных продажах в любой сфере. Умеете совмещать настойчивость с вежливостью. Понимаете специфику общения...,Вести телефонные переговоры с представителями компаний по теплым и холодным базам. Готовые клиентские базы предоставляются. Активно продавать бизнес-клиентам услуги...,between1And3,От 1 года до 3 лет,78638,Тинькофф,,,,
81404595,Оператор по раннему взысканию (удалённо),https://hh.ru/applicant/vacancy_response?vacancyId=81404595,part,Частичная занятость,37000,,Четкую и грамотную речь. Умение аргументировать свою позицию. Это пригодится и в работе и в жизни. Стрессоустойчивость: вести диалог в...,"Вести переговоры с клиентом и его окружением. Совершать исходящие и принимать входящие звонки. Выставлять требование на оплату долга, договариваться о...",noExperience,Нет опыта,78638,Тинькофф,,,,
81399861,Слесарь-ремонтник 5 разряда,https://hh.ru/applicant/vacancy_response?vacancyId=81399861,full,Полная занятость,62000,76000,"Свидетельство или иной документ, подтверждающий прохождение программы профессионального обучения по профессиям: «Слесарь», «Слесарь-ремонтник», «Слесарь по ремонту технологических установок». ","Дефектация, разборка, сборка, регулировка и ремонт металлорежущего, деревообрабатывающего, кузнечнопрессового и другого оборудования. Навыки по дефектации, разборке, сборке, регулировке и ремонту...",between3And6,От 3 до 6 лет,1380906,ДВЗ ЗВЕЗДА,,,,
81399728,Слесарь по ремонту и обслуживанию перегрузочных машин 5 разряда,https://hh.ru/applicant/vacancy_response?vacancyId=81399728,full,Полная занятость,62000,76000,"Свидетельство или иной документ, подтверждающий прохождение программы профессионального обучения по профессии: «Слесарь по ремонту и обслуживанию перегрузочных машин» или по...","Выполнение технического обслуживания и текущих ремонтов грузоподъемных кранов (мостовые и портальные краны). —Обслуживание, установка, наладка и ремонт приборов безопасности грузоподъемных...",between1And3,От 1 года до 3 лет,1380906,ДВЗ ЗВЕЗДА,,,,
81399557,Электромонтер по ремонту и обслуживанию электрооборудования 5-6 разряда,https://hh.ru/applicant/vacancy_response?vacancyId=81399557,full,Полная занятость,62000,82000,"Свидетельство или документ, подтверждающий прохождение программы профессионального обучения по профессии «Электромонтер по ремонту и обслуживанию электрооборудования». — Стаж работы электромонтером по...",Обслуживание и капитальный ремонт электрической части металлорежущих станков и подъёмных сооружений. — Обслуживание и ремонт релейной защиты цехового электрооборудования. — ,between1And3,От 1 года до 3 лет,1380906,ДВЗ ЗВЕЗДА,,,,
81398893,Продавец-кассир,https://hh.ru/applicant/vacancy_response?vacancyId=81398893,full,Полная занятость,,40000,Вежливость. Пунктуальность. Аккуратность.,Выкладка/ приём товаров. Обслуживание покупателей.,between1And3,От 1 года до 3 лет,9914898,Хмелевский Михаил,42.847375,132.960256,,
79971753,Инструктор противопожарной профилактики,https://hh.ru/applicant/vacancy_response?vacancyId=79971753,full,Полная занятость,29000,32000,"Высшее, средне-специальное образование. - Стаж работы не менее 1 года.","Осуществление ПН с целью поддержания требуемого уровня пожарной безопасности зданий, сооружений и помещений на территории охраняемых объектов и пресечения их...",noExperience,Нет опыта,1143866,РН-Пожарная безопасность,42.784157,132.885381,,
81393072,Водитель категории ВС на легковую машину,https://hh.ru/applicant/vacancy_response?vacancyId=81393072,full,Полная занятость,35000,,Наличие водительского удостоверения категории В или ВС.,Работа водителем категории В на легковом автотранспорте предприятия. Обслуживание автомобиля.,between1And3,От 1 года до 3 лет,3216750,МУП Находка-Водоканал,42.846198,132.935193,,
81391173,Экономист,https://hh.ru/applicant/vacancy_response?vacancyId=81391173,full,Полная занятость,100000,100000,Высшее образование. Опыт работы от 3 лет.,"1. Выполняет работу по осуществлению экономической деятельности предприятия, направленной на повышение эффективности и рентабельности производства, качества выпускаемой и освоение новых...",between1And3,От 1 года до 3 лет,4452470,Невод,,,,
80621994,Начинающий специалист,https://hh.ru/applicant/vacancy_response?vacancyId=80621994,full,Полная занятость,30000,,"Коммуникативные навыки и внимательное отношение к людям. Желание узнавать новое, готовность изучать продукты и услуги банка. Амбиции достигать результатов и...",Делать жизнь клиентов комфортнее: оформлять кредитные продукты и помогать людям приобретать необходимую технику в магазинах DNS. Презентовать услуги банка посетителям...,noExperience,Нет опыта,1049556,Почта Банк,,,,
81385440,Хореограф,https://hh.ru/applicant/vacancy_response?vacancyId=81385440,full,Полная занятость,27000,45000,,,noExperience,Нет опыта,9049720,Григорьев Анатолий Юрьевич,42.778618,132.862286,,
81384934,Дорожный мастер (дорожно-строительный участок),https://hh.ru/applicant/vacancy_response?vacancyId=81384934,full,Полная занятость,180000,,Высшее или средне-специальное (строительное) образование. Стаж работы не менее 3-х лет. Умение читать чертежи. Умение пользоваться справочной и...,Организация работы автотранспорта и дорожной техники при организации работ по реконструкции и содержанию автодорог. Обеспечение ежедневных плановых показателей работ строительного...,between3And6,От 3 до 6 лет,4987434,Охотская Горно-Геологическая Компания,,,,
81384555,Автоэлектрик,https://hh.ru/applicant/vacancy_response?vacancyId=81384555,full,Полная занятость,,,"Выявлять причины и находить способы обнаружения и устранения неисправностей электрооборудования, возникших в эксплуатации автомобиля. Знание устройства, принципа работы электрооборудования автомобилей...",Выполнение диагностики и тестирования автомобильной электроники. Обеспечение своевременного ремонта электроники и электрооборудования в автомобиле. Наблюдение за корректностью работы инструментов. ,between1And3,От 1 года до 3 лет,4987434,Охотская Горно-Геологическая Компания,,,,
81383981,Начальник автотранспортного отдела,https://hh.ru/applicant/vacancy_response?vacancyId=81383981,full,Полная занятость,90000,,Знание законодательства в сфере организации жизнедеятельности автотранспортных предприятий (БДД). - Знание устройства автомобильной и специальной техники. - Способность работать в условиях многозадачности. - ,обеспечение наличия на складе ЗИП и других необходимых запчастей и тех. жидкостей для автотранспортных средств и спецтехники. - разработка мероприятий по...,moreThan6,Более 6 лет,9368060,Сухой порт Находка,42.839581,132.935031,,
78062879,Фармацевт (г. Находка),https://hh.ru/applicant/vacancy_response?vacancyId=78062879,full,Полная занятость,70000,,"Высшее образование провизора или среднее специальное фармацевтическое образование. Наличие диплома, свидетельства об аккредитации специалиста.","Оказание грамотной, профессиональной консультации по лекарственным препаратам, БАД и лечебной косметики. Отпуск лекарственных препаратов и сопутствующих товаров. Соблюдение фармацевтического порядка...",noExperience,Нет опыта,2619413,Фарматика,,,,
78805177,Продавец-консультант/бьюти-эксперт (Сити Центр),https://hh.ru/applicant/vacancy_response?vacancyId=78805177,full,Полная занятость,,35000,"Средняя продолжительность работы Консультанта в нашем регионе составляет 3,5 года. Желания помогать людям и делать их красивее. ","Знакомить наших посетителей с ассортиментом продукции, помогать в реализации их потребностей.",noExperience,Нет опыта,30637,ЛЭтуаль,42.835641,132.882345,,
81383790,Программист 1 С,https://hh.ru/applicant/vacancy_response?vacancyId=81383790,full,Полная занятость,120000,,"Наличие высшего образования. Опыт интеграции решений 1С с другими информационными системами. Опыт работы с клиент-серверной архитектурой, с управляемыми...","Автоматизация бизнес-процессов компании за счет внедрения новых информационных технологий и версий ПО, доработка действующего программного обеспечения по запросам подразделений...",between3And6,От 3 до 6 лет,5926161,Терминал Астафьева,42.796933,132.891508,,
81380670,"Водитель-курьер, подработка (доставка небольших посылок)",https://hh.ru/applicant/vacancy_response?vacancyId=81380670,part,Частичная занятость,67000,110000,НЕ Еда (подключение Еды при Вашем желании). Для работы подходит любой автомобиль. Стаж вождения не требуется. Опыт работы не требуется.,"Телефон или планшет на платформе ANDROID или IOS. Доставка небольших посылок, пакетов, коробок, товаров (просто доставка из точки А в...",noExperience,Нет опыта,2198765,Квазар,,,,
81376826,Администратор,https://hh.ru/applicant/vacancy_response?vacancyId=81376826,full,Полная занятость,32000,65000,"Позитивная, общительная, легко находишь общий язык с любыми людьми. Имеешь опыт работы администратором (будет твоим преимуществом) , если нет – всему научим.","Отвечать за жизнедеятельность студии: открывать / закрывать студию, следить за чистотой и порядком в студии во время проведения занятий для комфортного...",between1And3,От 1 года до 3 лет,9049720,Григорьев Анатолий Юрьевич,42.831046,132.897563,,
81374746,Главный бухгалтер,https://hh.ru/applicant/vacancy_response?vacancyId=81374746,full,Полная занятость,,,Опыт работы от 7 лет Главным бухгалтером с полным функционалом по подготовке и сдаче бухгалтерской и налоговой отчетности в компаниях...,"Контроль и ведение бухгалтерского и налогового учета в полном объеме по 1 юр лицу, льготное налогообложение. Анализ и корректировка текущих...",moreThan6,Более 6 лет,710,Staffwell,,,,
81374003,Горничная,https://hh.ru/applicant/vacancy_response?vacancyId=81374003,full,Полная занятость,60000,60000,,"2.уборка коридоров, туалетных комнат, раздевалок, гардеробных, душевых. Комнат в общежитиях и жилых помещениях, Под влажной уборкой подразумевается: 1.Протирка пыли: с...",noExperience,Нет опыта,1071927,Литона,,,,
81373320,Кухонный работник,https://hh.ru/applicant/vacancy_response?vacancyId=81373320,full,Полная занятость,65000,65000,,"Ставить на столы кухонные приборы, а также посуду. Собирать отходы пищевого производства. Мыть посуду. Дезинфицировать свое рабочее место. ",noExperience,Нет опыта,1071927,Литона,,,,
80208046,Промоутер,https://hh.ru/applicant/vacancy_response?vacancyId=80208046,part,Частичная занятость,36000,,ОСНОВНЫЕ ПРЕИМУЩЕСТВА: Нет опыта? Научим!,"Промоутер подработка в том числе студентам, школьникам.",noExperience,Нет опыта,2324776,Промоушен.ру,,,,
81346500,Ведущий консультант/методолог 1С,https://hh.ru/applicant/vacancy_response?vacancyId=81346500,full,Полная занятость,230000,230000,Опыт внедрения информационных систем на базе 1С в нескольких предметных областях. Знакомство с конфигурациями на базе 1С ERP. ,Собирать и анализировать требования к системе у владельцев бизнес-процессов. Формализовать новые требования к доработкам для программистов. Наставничество.,moreThan6,Более 6 лет,993238,Маскон,,,,
81344346,Инженер-геодезист,https://hh.ru/applicant/vacancy_response?vacancyId=81344346,full,Полная занятость,200000,,Высшее профессиональное образование соответствующего профиля. Знание нормативно-правовых актов в части организации и осуществления строительного контроля в части инженерных изысканий. ,"Проведение геодезического контроля всех ответственных конструкций (визуальным и инструментальным методами). Контроль соответствия, своевременного и достоверного оформления Строительным Подрядчиком исполнительной документации...",between3And6,От 3 до 6 лет,766436,Общество с ограниченной ответственностью Свис Инжиниринг Груп,,,,
77692978,"Слесарь-электрик 5 разряда, г.Находка",https://hh.ru/applicant/vacancy_response?vacancyId=77692978,full,Полная занятость,30000,,Образование- начальное профессиональное(техническое). Аттестация по электробезопасности. Группа допуска по электробезопасности не ниже 3. Стаж работы по ремонту и обслуживанию...,"Обеспечение бесперебойной работы, техническое обслуживание, ремонт электрического и технологического оборудования АЗС/К участка АЗС в г. Находка.",between1And3,От 1 года до 3 лет,2249319,Востокнефтепродукт,,,,
81340151,Старший помощник капитана,https://hh.ru/applicant/vacancy_response?vacancyId=81340151,full,Полная занятость,365000,367000,"Опыт работы в должности старшего помощника капитана на контейнеровозах не менее 1-го контракта. Знание английского языка на уровне, необходимом...",Погрузка/выгрузка (контейнеровоз). Несение ходовой вахты на мостике. Выполнение служебных обязанностей старшего помощника капитана в соответствии с должностной инструкцией. ,between1And3,От 1 года до 3 лет,2493014,Транзит,,,,
81339205,Помощник системного администратора,https://hh.ru/applicant/vacancy_response?vacancyId=81339205,full,Полная занятость,,32000,,"Установка, настройка программного обеспечения, оборудования. Диагностика, ремонт и обслуживание вверенного оборудования (кассовое, торговое, офисное). Обеспечение бесперебойного функционирования СКС (протяжка, наладка...",noExperience,Нет опыта,641527,Розничное направление ГК Невада,42.778446,132.853779,,
81335395,Почтальон,https://hh.ru/applicant/vacancy_response?vacancyId=81335395,full,Полная занятость,22000,25000,"Готовность к пешеходному передвижению по городу или населенному пункту. Готовность к работе с денежными средствами. Будет плюсом, если у вас...","Доставлять и вручать адресатам почтовые отправления, печатные издания, рекламные материалы и письменную корреспонденцию. Доставлять и вручать пенсии и пособия. ",noExperience,Нет опыта,4352,Почта России,42.810632,132.878761,,
79958235,Водитель на ГАЗель,https://hh.ru/applicant/vacancy_response?vacancyId=79958235,full,Полная занятость,71000,,Образование не ниже среднего. - Наличие водительского удостоверения категории В. - Подтвержденный опыт работы (по трудовой книжке!) водителем от 3-х лет...,"Прием товара на складе, размещение в кузове и доставка товара по торговым точкам. - Работа на маршруте с торговым представителем.",between3And6,От 3 до 6 лет,2671,"СНС, Группа компаний",42.820261,132.85386,,
80204319,Менеджер по продажам в сегменте b2b,https://hh.ru/applicant/vacancy_response?vacancyId=80204319,full,Полная занятость,50000,100000,Целеустремлённость и настойчивость. Грамотная речь и умение находить общий язык с людьми. Желание и умение учиться новому в сфере продажи...,"Вести переговоры и заключать сделки с новыми клиентами. Следить за базой клиентов, продлевать договоры текущих рекламодателей.",noExperience,Нет опыта,64174,2ГИС,42.836751,132.88107,,
