id,name,url,employment_id,employment_name,salary_from,salary_to,snippet_requirement,snippet_responsibility,experience_id,experience_name,employer_id,employer_name,address_lat,address_lng,professional_roles_id,professional_roles_name
82215349,Бухгалтер по учёту ТМЦ и ОС,https://hh.ru/applicant/vacancy_response?vacancyId=82215349,full,Полная занятость,,,Высшее/средне-специальное экономическое образование. Аналогичный опыт работы от 1 года. Опыт работы на производственных предприятиях приветствуется. Хорошее знание ПК...,"Организация и ведение оперативного, бухгалтерского и управленческого учета ТМЦ и ОС. Формирование внутренней управленческой отчетности. Работа с авансовыми отчётами. ",between1And3,От 1 года до 3 лет,697283,Группа Компаний «Доброфлот»,42.862675,132.696259,,
48266958,Продавец-консультант в Ювелирный салон,https://hh.ru/applicant/vacancy_response?vacancyId=48266958,full,Полная занятость,25000,,опыт в продажах приветствуется. -коммуникабельность и отзывчивость.,консультирование покупателей про продукции. -заключение договоров с покупателями. -выполнение плана продаж. -работа с программой 1с и кассовыми операциями.,noExperience,Нет опыта,1590260,Золотая мозаика,,,,
80374760,Монтажник интернет-сетей,https://hh.ru/applicant/vacancy_response?vacancyId=80374760,full,Полная занятость,55000,,Есть интерес к сфере телекома и желание развиваться в заданном направлении ( нет опыта- мы научим!). Имеется опыт монтажных работ линий...,"Подключение услуг Компании. Монтаж, установка и настройка оконечного абонентского оборудования. Демонстрация работоспособности услуг. Консультация пользователей по вопросам настройки абонентского оборудования...",noExperience,Нет опыта,2748,Ростелеком,,,,
81556516,Старший клиентский менеджер,https://hh.ru/applicant/vacancy_response?vacancyId=81556516,full,Полная занятость,56000,,"Специалист со средним профессиональным, неполным высшим или высшим образованием. Доброжелателен и готов помогать клиентам. Будет плюсом, если у тебя есть...",Предлагать продукты и услуги Сбера. Консультировать клиентов по возникающим вопросам. Помогать клиентам оформлять услуги и необходимые для них документы. ,noExperience,Нет опыта,3529,СБЕР,,,,
81557602,Старший менеджер по обслуживанию,https://hh.ru/applicant/vacancy_response?vacancyId=81557602,full,Полная занятость,50400,,"Специалист со средним профессиональным, неполным высшим или высшим образованием. Будет плюсом, если у тебя есть опыт работы в сфере продаж...","Доброжелателен и готов помогать клиентам. Готов к работе, предполагающей ежедневное проведение однотипных операций. Осуществлять операции по обслуживанию клиентов. ",noExperience,Нет опыта,3529,СБЕР,,,,
81838866,Пишущий редактор в Яндекс,https://hh.ru/applicant/vacancy_response?vacancyId=81838866,full,Полная занятость,75000,,"Быстро разбираться в сложных незнакомых темах: от алгебры до поэзии. Не боитесь рутины, готовы часами докапываться до истины, разбираться в...","Проверять факты и отличать надёжные источники от сомнительных. Писать и редактировать тексты, которые решают задачи людей. Соблюдать гайды, регламенты, редполитики...",between3And6,От 3 до 6 лет,9498112,Яндекс Крауд,,,,
78273209,Работник ночной смены предприятия «Вкусно - и точка»,https://hh.ru/applicant/vacancy_response?vacancyId=78273209,full,Полная занятость,,,"Наличие документов, необходимых для трудоустройства по ТК РФ. Возраст от 18 лет. Опыт не требуется.","Готовить предприятие к ежедневному открытию для визитов наших гостей, поддерживая чистоту и порядок в помещениях. Проводить профилактику кухонного оборудования и...",noExperience,Нет опыта,2624085,Вкусно — и точка,,,,
76462869,Машинист каротажной станции,https://hh.ru/applicant/vacancy_response?vacancyId=76462869,full,Полная занятость,,,"Удостоверение Машиниста каротажной станции. Наличие водительского удостоверения категории В, С. Стаж вождения по категории ""С"" от 3 лет! ","Управление каротажной станцией, подъемными механизмами (лебедка) при проведении геофизических исследований в скважинах глубиной до 6000 метров. Спуск аппаратуры (приборов) в...",between3And6,От 3 до 6 лет,39305,Газпром нефть,,,,
81716768,Работник предприятия «Вкусно – и точка»,https://hh.ru/applicant/vacancy_response?vacancyId=81716768,full,Полная занятость,,,Более 30 лет опыта работы по международным стандартам качества в индустрии гостеприимства на рынке России.,принимать гостей и дарить им то самое отличное обслуживание. - поддерживать помещения в чистом и красивом виде.,noExperience,Нет опыта,2624085,Вкусно — и точка,,,,
82213459,Слесарь-наладчик сварочного оборудования,https://hh.ru/applicant/vacancy_response?vacancyId=82213459,full,Полная занятость,50000,,"Опыт в ремонте и наладке сварочных аппаратов обязателен от 3-х лет. Начальное, среднее профессиональное образование(электрик, электромеханик).",Работа на территории организации (г Находка).,between3And6,От 3 до 6 лет,1949202,Находкинский судоремонтный завод,42.800743,132.876075,,
81816331,"Фармацевт-провизор (г. Находка, мк-рн п.Ливадия, Победы 9)",https://hh.ru/applicant/vacancy_response?vacancyId=81816331,full,Полная занятость,60000,,"Высшее или средне-специальное образование по специальности ""Фармация"". Актуальный сертификат специалиста (пройденная аккредитация).","Оказание грамотной, профессиональной консультации по лекарственным препаратам. Отпуск лекарственных средств и сопутствующих товаров. Соблюдение стандартов обслуживания покупателей. Соблюдение фармацевтического порядка...",noExperience,Нет опыта,9549189,ГОСАПТЕКА,42.858009,132.68804,,
80471172,Дорожный рабочий (г.Нерюнгри),https://hh.ru/applicant/vacancy_response?vacancyId=80471172,full,Полная занятость,100000,120000,Обязательное наличие опыта по данным видам работ. Наличие удостоверения монтажника (ЖБК). ЖЕЛАТЕЛЬНО. Умение работать нивелиром.,Выполнение дорожных работ в Нерюнгри - НГРЭС. Земляные работы. Подготовка основания из щебня и отсева. Укладка дорожных плит. Укладка тротуарной плитки. ,noExperience,Нет опыта,2249552,Апекс Групп,,,,
82211600,Механик,https://hh.ru/applicant/vacancy_response?vacancyId=82211600,full,Полная занятость,150000,150000,"Опыт с тяжелой техникой обязателен от 1 года (экскаваторы, бульдозеры, всего 4 техники в обслуживании).",Ремонт и обслуживание техники.,between1And3,От 1 года до 3 лет,9622609,Стис,,,,
82211101,Старший специалист по развитию и сопровождению конвергентных решений для государственных клиентов,https://hh.ru/applicant/vacancy_response?vacancyId=82211101,full,Полная занятость,,,"Высшее образование: (желательно). Знания действующих законодательных и правовых нормативных актов в отрасли «Связь», действующих законодательных и правовых нормативных актов о...",Обеспечивает рост новой выручки за счет продаж конвергентных решений (услуг мобильной и фиксированной связи) действующим государственным клиентам. Обеспечивает документальное и...,between1And3,От 1 года до 3 лет,3127,МегаФон,,,,
81871789,Специалист по охране труда отделения ФПС ГПС (г. Находка),https://hh.ru/applicant/vacancy_response?vacancyId=81871789,full,Полная занятость,22000,40000,"Высшее образование по направлению ""техносферная безопасность"", без предъявления требований к стажу работы; при среднем образовании опыт работы три года либо...","Своевременное и качественное выполнение приказов, распоряжений и указаний вышестоящего руководства. - Контроль за соблюдением законодательных и иных нормативных правовых актов по...",noExperience,Нет опыта,4527213,Главное управление МЧС России по Приморскому краю,42.803501,132.875248,,
81336074,Специалист по портам Дальнего Востока,https://hh.ru/applicant/vacancy_response?vacancyId=81336074,full,Полная занятость,60000,,"имеешь опыт в организации морских, железнодорожных, международных перевозок (это желательно, но также готовы рассмотреть без опыта, есть обучение). - ",приём входящих заявок. - деловая переписка. - документальное обеспечение доставки грузов (оформление железнодорожных документов для отгрузки контейнеров). - оформление товарно-транспортных и сопроводительных...,noExperience,Нет опыта,2335138,ТетраТранс,42.726325,133.082984,,
82208982,Инженер по охране окружающей среды (эколог),https://hh.ru/applicant/vacancy_response?vacancyId=82208982,full,Полная занятость,80000,107000,,"Участие в прохождении плановых и внеплановых проверок природоохранными органами, устранение нарушений. - Разработка проектов организации по предотвращению загрязнения окружающей среды. - ",between1And3,От 1 года до 3 лет,4001007,ВУТ,42.728325,133.081286,,
82208705,Уборщик производственных и служебных помещений,https://hh.ru/applicant/vacancy_response?vacancyId=82208705,full,Полная занятость,,,,образовательные займы.,noExperience,Нет опыта,5955087,РН-Морской терминал Находка,,,,
81385424,"Продавец-консультант (ТЦ ""Галерея"")",https://hh.ru/applicant/vacancy_response?vacancyId=81385424,full,Полная занятость,38000,57000,"Говоришь с ПК на «ты». Надёжен, ответственен, внимателен и аккуратен. Готов работать в команде.",Продажей товаров и консультированием покупателей. Информированием клиентов о действующих рекламных акциях. Послепродажной проверкой товара и настройкой технического оборудования покупателей. ,noExperience,Нет опыта,2523,М.Видео-Эльдорадо,42.830107,132.896862,,
77103350,Продавец-консультант мебели,https://hh.ru/applicant/vacancy_response?vacancyId=77103350,full,Полная занятость,35000,55000,"Развитые коммуникативные навыки. Желание развиваться в сфере продаж. Нацеленность на результат, желание продавать и зарабатывать!","Работа с покупателем на всех этапах продаж, установление долгосрочных отношений. Консультирование по ассортименту. Оформление документов.",noExperience,Нет опыта,3055544,Полищук Александра Александровна,42.84561,132.946242,,
77103359,Помощник продавца,https://hh.ru/applicant/vacancy_response?vacancyId=77103359,full,Полная занятость,25000,35000,,"Работа с документами, компьютером, ценники, инвентаризации, фарпост. Чистота в зале.",noExperience,Нет опыта,3055544,Полищук Александра Александровна,,,,
78544848,Продавец-консультант мебели,https://hh.ru/applicant/vacancy_response?vacancyId=78544848,full,Полная занятость,35000,55000,"Развитые коммуникативные навыки. Желание развиваться в сфере продаж. Нацеленность на результат, желание продавать и зарабатывать!","Работа с покупателем на всех этапах продаж, установление долгосрочных отношений. Консультирование по ассортименту. Оформление договоров.",noExperience,Нет опыта,3055544,Полищук Александра Александровна,42.848108,132.889595,,
79355821,Продавец-консультант мебели,https://hh.ru/applicant/vacancy_response?vacancyId=79355821,full,Полная занятость,35000,55000,"Развитые коммуникативные навыки. Желание развиваться в сфере продаж. Нацеленность на результат, желание продавать и зарабатывать!","Работа с покупателем на всех этапах продаж, установление долгосрочных отношений. Консультирование по ассортименту. Оформление договоров.",noExperience,Нет опыта,3055544,Полищук Александра Александровна,42.778446,132.853779,,
80327429,Продавец,https://hh.ru/applicant/vacancy_response?vacancyId=80327429,full,Полная занятость,30000,40000,Можно без опыта.,Продажа. Поддержание выставки в чистоте. Работа на компьютере. Заключение трудового договора.,noExperience,Нет опыта,3055544,Полищук Александра Александровна,42.848108,132.889595,,
80331919,Продавец,https://hh.ru/applicant/vacancy_response?vacancyId=80331919,full,Полная занятость,50000,70000,"Вакансия подходит , в том числе, для студентов.",Продажа. Поддержание выставки в чистоте. Работа на компьютере. Консультирование по ассортименту.,noExperience,Нет опыта,3055544,Полищук Александра Александровна,,,,
80332867,Помощник продавца мебели,https://hh.ru/applicant/vacancy_response?vacancyId=80332867,full,Полная занятость,25000,35000,"Вакансия подходит, в том числе, для студентов.","Работа с документами, компьютером, ценники, инвентаризации, фарпост. Чистота в зале. Помощь в продажах.",noExperience,Нет опыта,3055544,Полищук Александра Александровна,,,,
80471040,Сборщик мебели,https://hh.ru/applicant/vacancy_response?vacancyId=80471040,full,Полная занятость,50000,55000,Трудолюбие. Физически крепкий.,Сборка. Погрузка разгрузка. Ремонт мебели. Складирование. Упаковка. Вынос мусора.,noExperience,Нет опыта,3055544,Полищук Александра Александровна,42.84561,132.946242,,
80360712,Продавец-кассир,https://hh.ru/applicant/vacancy_response?vacancyId=80360712,full,Полная занятость,40000,70000,Наличие активной жизненной позиции. Нацеленность на результат. Желание обучаться и развиваться. Доброжелательность и готовность помочь.,"Работа в зале,консультирование клиентов. Работа с компьютером. Чистота в зале. Оформление документации.",noExperience,Нет опыта,3055544,Полищук Александра Александровна,,,,
80471594,Разнорабочий,https://hh.ru/applicant/vacancy_response?vacancyId=80471594,full,Полная занятость,35000,40000,,Упаковка товара. Погрузка - разгрузка. Сборка.,noExperience,Нет опыта,3055544,Полищук Александра Александровна,42.84561,132.946242,,
82207319,Монтер пути,https://hh.ru/applicant/vacancy_response?vacancyId=82207319,full,Полная занятость,55000,55000,ОПЫТ РАБОТЫ НЕ ТРЕБУЕТСЯ.,"Монтаж, демонтаж и ремонт конструкций верхнего строения пути (рельсы, шпалы, брусья, блоки). Выполнение работ по текущему содержанию железнодорожного пути. ",noExperience,Нет опыта,23427,Российские железные дороги,42.846337,132.94865,,
79179079,Продавец-консультант,https://hh.ru/applicant/vacancy_response?vacancyId=79179079,full,Полная занятость,33000,46500,Стрессоустойчивость. Коммуникабельность. Работа в команде.,Консультирование клиентов. Выкладка товаров. Поддержание чистоты и порядка в торговом зале. Участие в приемке товаров. Кассовая дисциплина. Расчет клиентов на...,noExperience,Нет опыта,4175135,Бонжур,,,,
82206325,Менеджер АХО,https://hh.ru/applicant/vacancy_response?vacancyId=82206325,full,Полная занятость,40000,,"Опыт работы по электрике, сантехнике, строительству. Ответственность, честность. Дисциплинированность. Приветствуются удостоверения на группу доступа к эл. безопасности, охраны труда (в...","Обеспечение жизнедеятельности предприятия, контроль за санитарным и техническим состоянием зданий и прилегающих территорий. Организация обслуживания сантехнических и электрических систем. ",noExperience,Нет опыта,872053,MX group,42.836751,132.907453,,
82206315,Уборщик помещения,https://hh.ru/applicant/vacancy_response?vacancyId=82206315,full,Полная занятость,25000,25000,Опрятный внешний вид. Ответственность. Исполнительность.,"Сухая и влажная уборка складских, офисных и бытовых помещений. Поддержание надлежащего санитарного состояния помещений.",noExperience,Нет опыта,872053,MX group,42.836751,132.907453,,
82205870,"Водитель с автомобилем (универсал, минивэн, микроавтобус)",https://hh.ru/applicant/vacancy_response?vacancyId=82205870,full,Полная занятость,84000,,Для работы потребуется легковой универсал (типа / минивэн / микроавтобус / фургон. Внимательность. Ответственность.,Своевременная доставка товара (новых автозапчастей) по городу. Работа с документацией. Работа с наличностью.,noExperience,Нет опыта,114735,Автотрейд,42.847626,132.946835,,
82205690,Менеджер по продажам и работе с клиентами,https://hh.ru/applicant/vacancy_response?vacancyId=82205690,full,Полная занятость,35000,75000,Готовность к активной работе с покупателями. Развитые коммуникативные навыки. Ориентация на результат. Грамотная устная и письменная речь.,Консультировать покупателей по ассортименту (только входящие покупатели). Устанавливать долгосрочные отношения с клиентами. Работать в нашей уникальной дизайнерской программе (обучаем). ,noExperience,Нет опыта,66212,Торговый дом Лазурит,,,,
82205616,Начальник службы подъёмных механизмов,https://hh.ru/applicant/vacancy_response?vacancyId=82205616,full,Полная занятость,,,Наличие действующей аттестации по промышленной безопасности. Наличие аттестации по электро-безопасности не ниже 3 группы. Опыт ремонта и эксплуатации подъемных...,Руководство службой подъёмных механизмов.,moreThan6,Более 6 лет,5926161,Терминал Астафьева,,,,
