id,name,url,employment_id,employment_name,salary_from,salary_to,snippet_requirement,snippet_responsibility,experience_id,experience_name,employer_id,employer_name,address_lat,address_lng,professional_roles_id,professional_roles_name
82213934,Мастер по ремонту оборудования котельных и пылеприготовительных цехов,https://hh.ru/applicant/vacancy_response?vacancyId=82213934,full,Полная занятость,100000,150000,"Высшее техническое образование и стаж работы, связанной с производством работ на электростанциях не менее 1 года. Среднетехническое образование и стаж...",Осуществление технического руководства бригадой при проведении ремонта оборудования. Осуществление контроля за соблюдением технологии ремонта оборудования. Обеспечивать при проведении ремонтных работ...,between1And3,От 1 года до 3 лет,876195,Сибирская генерирующая Компания,,,,
81578873,Специалист по обслуживанию базовых станций,https://hh.ru/applicant/vacancy_response?vacancyId=81578873,full,Полная занятость,50000,,Знание основ электробезопасности; группа по электробезопасности не ниже 3. Готовность к разъездному характеру работы.,Аварийно-восстановительные и плановые работы на базовых станций сотовой связи. Обеспечение аварийного электроснабжения базовых станций операторов от переносного генератора. ,between1And3,От 1 года до 3 лет,2748,Ростелеком,46.441449,134.29897,,
78862842,Продавец-консультант,https://hh.ru/applicant/vacancy_response?vacancyId=78862842,full,Полная занятость,23000,38500,,Работа с клиентами. Консультирование клиентов по продукции магазина. Выкладка товаров по стандартам сети. Участие в инвентаризации. Кассовые операции.,noExperience,Нет опыта,4175135,Бонжур,,,,
80139173,Продавец-консультант,https://hh.ru/applicant/vacancy_response?vacancyId=80139173,full,Полная занятость,40000,,Желателен опыт в проектировании и продажах.,"Консультирование покупателей с целью продажи кухонь. Проектирование, подбор мебели для кухни, расчет стоимости по заказам покупателей. Оформление и сопровождение продажи. ",between1And3,От 1 года до 3 лет,936984,Деловые люди,46.443665,134.312813,,
76196909,Администратор магазина,https://hh.ru/applicant/vacancy_response?vacancyId=76196909,full,Полная занятость,45000,56000,"уверенный пользователь ПК. - опыт личных продаж от одного года. - лидерский потенциал, инициативность, обучаемость.","руководство деятельностью торгового зала магазина. - организация, контроль работы продавцов и кассиров в торговом зале. - наставничество, обучение торгового персонала. - ",between1And3,От 1 года до 3 лет,732829,Домотехника,46.444026,134.297785,,
76196837,Продавец,https://hh.ru/applicant/vacancy_response?vacancyId=76196837,full,Полная занятость,35000,55000,коммуникабельность. -обучаемость. -активность. -опыт кассовой работы не менее года будет вашим преимуществом.,"обслуживание покупателей. - документальное оформление покупки. - оформление витрин, стеллажей, поддержание чистоты и порядка на рабочем месте.",noExperience,Нет опыта,732829,Домотехника,46.444026,134.297785,,
82169149,Водитель самосвала,https://hh.ru/applicant/vacancy_response?vacancyId=82169149,full,Полная занятость,120000,,Водительское удостоверение категории С.,"Управление грузовым автомобилем FAW, HOWO. Содержание автомобиля в исправном состоянии, ремонт и техническое обслуживание. Оформление путевой и иной технической документации.",between1And3,От 1 года до 3 лет,5770805,Империя Строй,,,,
82166543,Оператор по назначению встреч (удалённо),https://hh.ru/applicant/vacancy_response?vacancyId=82166543,full,Полная занятость,35000,,Полное среднее образование и выше. Внимательность к деталям. Уверенность в себе и умение расположить клиента. Четкая и грамотная речь.,"Консультировать действующих и потенциальных клиентов по теплой базе на исходящих звонках. Назначать удобную дату, время и место встречи с представителем. ",noExperience,Нет опыта,78638,Тинькофф,,,,
81641797,Повар-универсал,https://hh.ru/applicant/vacancy_response?vacancyId=81641797,full,Полная занятость,60000,80000,,"Количество туристов на базе до 100 человек. Основные требования : соблюдение всех санитарно-гигиенических норм требований,соблюдение условий хранения продукции,исключение...",moreThan6,Более 6 лет,9651702,Дружин Игорь Станиславович,,,,
79424284,Менеджер по сервисному обслуживанию клиентов,https://hh.ru/applicant/vacancy_response?vacancyId=79424284,part,Частичная занятость,,,Опыт работы с клиентами и в продажах приветствуется. Общительность и способность найти подход к каждому человеку. Опытный пользователь ПК. ,"Делать мелкий сервисный ремонт слуховых аппаратов: замена трубочки, чистка аппарата и т.д. Проводить экспресс-проверки слуха на планшете или...",between1And3,От 1 года до 3 лет,1626978,Клиника слуха Аудионика,,,,
82085691,Водитель автомобиля на вывозке леса,https://hh.ru/applicant/vacancy_response?vacancyId=82085691,full,Полная занятость,80000,,"6. Знание внутреннего устройства импортных грузовых автомобилей. Требования: 1. Опыт работы от 3 лет на лесовозах зарубежных производителей (SHACMAN, MERCEDES). ","2. Контроль выполнения погрузочно-разгрузочных работ, соблюдение техники безопасности при погрузо-разгрузочных работах. 3. Материальная ответственность за груз. 4. ",between3And6,От 3 до 6 лет,606667,RFP Group,,,,
79134425,Директор магазина,https://hh.ru/applicant/vacancy_response?vacancyId=79134425,full,Полная занятость,50000,60000,"Активные лидеры, которые смогут справиться с большим трафиком покупателей. Ответственные, целеустремленные люди, преданные своей профессии. Аналогичный опыт в ритейле. ","Активные продажи. Эффективное управление внутренними процессами магазина (графики работы сотрудников, инвентаризация, отчетность и т.д.). Обучение новых сотрудников. ",between1And3,От 1 года до 3 лет,2779310,Алкомаркет Столица,46.443355,134.302627,,
81336585,Менеджер продаж финансовых продуктов,https://hh.ru/applicant/vacancy_response?vacancyId=81336585,full,Полная занятость,,,,"Консультировать и помогать нашим постоянным клиентам (только физические лица). Продавать продукты и услуги банка, которые сделают клиента счастливее: Продаешь Банковские...",noExperience,Нет опыта,1496,Банк Хоум Кредит,,,,
81992171,Автослесарь по ремонту грузовых автосамосвалов и специальной техники импортного производства,https://hh.ru/applicant/vacancy_response?vacancyId=81992171,full,Полная занятость,100000,140000,Опыт работы от 1 год. Знание технического устройства автомобилей и тяжелой техники. Желание работать.,"Ремонт автосамосвалов марки Мерседес, Вольво, Шахман. Ремонт спецтехники (экскаватор, бульдозер, каток, автогрейдер).",between1And3,От 1 года до 3 лет,6051445,Альфа-Кар ТРАК,,,,
81929466,Геодезист,https://hh.ru/applicant/vacancy_response?vacancyId=81929466,full,Полная занятость,100000,120000,"Знание AutoCAD, AutoCAD Civil 3D и др. - Умение создавать и работать с ЦММ и ЦМР. - Умение создавать и работать...",Проведение исполнительных геодезических съемок. - Осуществление разбивочных и камеральных работ. - Подготовка исполнительных схем. - Сопровождение строительных объектов (площадных и линейных). - ,between3And6,От 3 до 6 лет,4372178,Техстрой,,,,
81929435,Механик-автослесарь,https://hh.ru/applicant/vacancy_response?vacancyId=81929435,full,Полная занятость,100000,,"Образование среднее специальное, опыт работы от 3-х лет. Ответственность, коммуникабельность, находчивость, оперативность, целеустремленность.","Ремонт автотранспорта и спецтехники. Заполнение ремонтных листов. Ведение учета рабочего времени слесарей, сварщиков. Ведение документации.",between3And6,От 3 до 6 лет,4372178,Техстрой,,,,
81929397,Главный инженер,https://hh.ru/applicant/vacancy_response?vacancyId=81929397,full,Полная занятость,250000,,Высшее образование. - Опыт работы не менее 5 лет​​​​​​​.,"Планирование, организация и контроль всех строительных процессов. - Составление графиков производства работ и контроль их исполнения. - Организация взаимодействия с подрядными организациями. - ",moreThan6,Более 6 лет,4372178,Техстрой,,,,
81928528,Администратор магазина,https://hh.ru/applicant/vacancy_response?vacancyId=81928528,full,Полная занятость,36000,36000,"Опыт работы старшим кассиром или администратором в магазине, также рассматриваем с опытом продавцов-кассиров (обучаем). — Умение грамотно распределить обязанности и...","Открытие/закрытие магазина. — Работа с персоналом: расстановка смен, составление графика перерыва. — Постановка и контроль выполнения задач. — Кассовая отчетность (касса, инкассация...",between1And3,От 1 года до 3 лет,1397765,Компания Санвэй,46.44338,134.302591,,
81918122,Оператор позднего взыскания (удалённо),https://hh.ru/applicant/vacancy_response?vacancyId=81918122,full,Полная занятость,45000,,Повышенный уровень стрессоустойчивости. Умение вести диалог в рамках деловых переговоров: не реагировать на негатив со стороны клиентов и не воспринимать...,Совершать исходящие звонки и принимать входящие. Работать с кредитными делами с просроченной задолженностью более 6 месяцев. Вести переговоры с должниками...,noExperience,Нет опыта,78638,Тинькофф,,,,
81894536,Диспетчер транспортного отдела,https://hh.ru/applicant/vacancy_response?vacancyId=81894536,full,Полная занятость,52000,52000,"Опыт работы от 1 года. Внимательность, ответственность, пунктуальность.","Обработка путевой документации (выдача, контроль заполнения и возврат путевых листов). Ведение ежесуточной отчетности (контроль вывозимых объемов, сбор информации и оформление...",between1And3,От 1 года до 3 лет,9817777,АТЭК,,,,
81882791,Повар,https://hh.ru/applicant/vacancy_response?vacancyId=81882791,full,Полная занятость,91000,98000,"Наличие медицинской книжки или готовность ее оформить. Профильное образование. Неконфликтность, стрессоустойчивость, выносливость.",Готовить блюда по технологическим картам. Заготавливать продукты на следующий день. Соблюдать сроки годности и условия хранения продуктов. Контролировать чистоту и...,between3And6,От 3 до 6 лет,6004888,КЛЕВЕР,45.102947,38.978295,,
79569703,Токарь-фрезеровщик,https://hh.ru/applicant/vacancy_response?vacancyId=79569703,full,Полная занятость,,,Опыт работы.,Работа на станках.,between1And3,От 1 года до 3 лет,876195,Сибирская генерирующая Компания,,,,
79569358,Монтажник технологических трубопроводов,https://hh.ru/applicant/vacancy_response?vacancyId=79569358,full,Полная занятость,100000,,Опыт работы на строительстве энергообъектов. Опыт работы с газорезательной аппаратурой.,Монтаж трубопроводов. Монтаж металлоконструкций котлоагрегата. Монтаж поверхностей нагрева котлоагрегата.,between3And6,От 3 до 6 лет,876195,Сибирская генерирующая Компания,,,,
81871941,Начальник отдела по административно-хозяйственным вопросам,https://hh.ru/applicant/vacancy_response?vacancyId=81871941,full,Полная занятость,70000,70000,Образование высшее или средне-специальное. Опыт работы по направлению АХВ на руководящей должности не менее 3 лет. Хорошие организаторские способности...,Организация и обеспечение надлежащих условий для жизнедеятельности объектов и персонала организации. Организация и осуществление взаимодействия с руководителями и сотрудниками органов...,between3And6,От 3 до 6 лет,876195,Сибирская генерирующая Компания,,,,
79424214,Начальник сметного отдела,https://hh.ru/applicant/vacancy_response?vacancyId=79424214,full,Полная занятость,130000,130000,Высшее образование (техническое или экономическое). Стаж работы по специальности на инженерно-технических должностях не менее пяти лет на промышленных предприятиях...,"Осуществление своевременного и качественного обеспечения ИТР сметной документацией для формирования стоимости работ по капитальному строительству, ремонту, техническому перевооружению и реконструкции...",between3And6,От 3 до 6 лет,876195,Сибирская генерирующая Компания,,,,
81871444,Сборщик мебели,https://hh.ru/applicant/vacancy_response?vacancyId=81871444,full,Полная занятость,40000,,Желателен опыт работы сборщиком мебели. Знание способов и правил сборки мебели.,Качественная сборка мебели в магазине и на адресах покупателей. Упаковка мебели на доставку. Прием товара. При необходимости-погрузо-разгрузочные работы.,noExperience,Нет опыта,936984,Деловые люди,46.443665,134.312813,,
81501598,Продавец-кассир в магазин (разные адреса),https://hh.ru/applicant/vacancy_response?vacancyId=81501598,full,Полная занятость,57700,60100,"Коммуникабельность, умение работать в команде, честность, желание работать с людьми. Опыт работы в данной сфере не требуется, мы готовы Вас...",Работа на кассе и обслуживание покупателей по принятым в Компании стандартам. Выкладка товара и смена ценников. Отслеживание сроков реализации продукции...,noExperience,Нет опыта,1189320,"Бристоль, сеть магазинов",46.442392,134.305366,,
81755262,Оператор по продаже банковских продуктов (удалённо),https://hh.ru/applicant/vacancy_response?vacancyId=81755262,full,Полная занятость,30000,,Понимание принципов качественного клиентского сервиса. Умение общаться грамотно и вежливо.,"Совершать исходящие звонки по холодным и теплым базам с целью продажи продуктов и услуг компании. База для обзвона предоставляется, поиск...",noExperience,Нет опыта,78638,Тинькофф,,,,
81696131,Менеджер по работе с клиентами г. Лучегорск,https://hh.ru/applicant/vacancy_response?vacancyId=81696131,full,Полная занятость,35000,,,"Работа с клиентами. Телефонные звонки. Сопровождение клиентов на всех этапах действия договора. Работа с программами 1C, Siebel, Word, Excel. ",noExperience,Нет опыта,1103383,ЦЕНТРОФИНАНС,46.446137,134.306184,,
68762461,"Водитель самосвала SHACMAN, FAW",https://hh.ru/applicant/vacancy_response?vacancyId=68762461,full,Полная занятость,145000,,"Водительское удостоверение С. - Опыт работы на самосвале обязателен (карьер, разрез, строительство). - Умение работать в команде, ответственность, коммуникабельность, внимательность, дисциплинированность, стрессоустойчивость.","Водитель самосвальной техники управляет грузовым автомобилем, задействованным на перемещении горной массы в карьере. -Совершает операции связанные с подъемным механизмом самосвала...",between3And6,От 3 до 6 лет,3988214,Бамстройуниверсал,,,,
81630388,Электромеханик,https://hh.ru/applicant/vacancy_response?vacancyId=81630388,full,Полная занятость,100000,,"Организовывать ведение технической документации в соответствии с ПБ и ПТЭ на экскаваторах, стаж работы по специальности не менее 3-х...","руководство правильной эксплуатацией и обеспечения бесперебойной, длительной, производительной работы экскаваторов типа ЭШ, а также кранового оборудования, установленного на этих экскаваторах...",between1And3,От 1 года до 3 лет,9521594,Амуруголь,,,,
78378967,Продавец-кассир (Лучегорск),https://hh.ru/applicant/vacancy_response?vacancyId=78378967,full,Полная занятость,32000,32000,"Опыт работы в торговле желателен. Ответственность за работу, доброжелательность, вежливость, трудолюбие, дисциплинированность.","Работа с покупателями на кассе. Обеспечение сохранности денежных средств, находящихся в распоряжении. Выкладка товара на полки, а также пополнение запаса. ",between1And3,От 1 года до 3 лет,1397765,Компания Санвэй,46.44338,134.302591,,
81556690,Водитель погрузчика,https://hh.ru/applicant/vacancy_response?vacancyId=81556690,full,Полная занятость,46000,,Навыки вождения погрузчиком. Требования: Наличие прав категории Д.,,noExperience,Нет опыта,5683987,КГУП Приморский экологический оператор,43.159054,131.928963,,
78168868,Эксперт по подбору персонала,https://hh.ru/applicant/vacancy_response?vacancyId=78168868,full,Полная занятость,120000,120000,"Высшее образование. Опыт работы по специальности ОБЯЗАТЕЛЕН! Опыт массового подбора персонала ОБЯЗАТЕЛЕН! Опыт работы на сайтах ""HH.ru"", ""Работа России"", ""Зарплата.ру"". ",Массовый подбор рабочего персонала и ИТР (~500 чел. в год). Ведение базы в E-staff на постоянной основе. ,moreThan6,Более 6 лет,876195,Сибирская генерирующая Компания,46.445063,134.296599,,
